{
  "schema_version": "1.0",
  "event_id": "0192f0c1-5c3e-7b2a-9f4e-0a1b2c3d4e5f",
  "event_ts": "2026-10-17T10:15:42.123Z",
  "observed_ts": "2026-10-17T10:15:42.400Z",
  "host": "host-alpha",
  "source": "app-nginx",
  "service": "svc-pay",
  "category": "http",
  "type": "http_5xx",
  "severity": "error",
  "message": "GET /pay/checkout returned 502",
  "template": "GET {path} returned {status}",
  "attributes": {
    "status": 502,
    "duration_ms": 812.4,
    "route": "/pay/checkout"
  },
  "trace_id": "8b3c1f0a9d2e47f5",
  "request_id": "req_7f3a",
  "depends_on": ["db-pay-primary"],
  "evidence_ref": null
}
